country,year,policy,export_tax_pct,products_covered_pct,source_reference
China,2023,Export controls on gallium and germanium (semiconductor materials),50.0,2.0,MOFCOM Announcement No. 28/2023; State Council PRC
China,2023,Export permits required for graphite products (battery anode),30.0,3.0,MOFCOM Announcement No. 49/2023; State Council PRC
China,2024,Rare earth export restrictions (permanent magnets for wind turbines/EVs),30.0,4.0,MOFCOM Announcement No. 30/2024; State Council PRC
China,2024,Antimony export controls (battery flame retardants),30.0,1.0,MOFCOM Announcement No. 34/2024; State Council PRC
China,2025,"Tungsten, tellurium, bismuth, molybdenum export controls",30.0,3.0,MOFCOM Announcement No. 2/2025; State Council PRC
Indonesia,2020,"Nickel ore export ban (full, effective Jan 2020)",100.0,5.0,MOT Regulation No. 11/2019; WTO DS592 Panel Report
Indonesia,2023,Bauxite export ban,100.0,2.0,MOT Regulation No. 22/2023; WTO Trade Monitoring Database
